{
  "baseline_validation": {
    "clock_timezone": {
      "expected": true,
      "metric": "deterministic_clock.timezone_aware",
      "observed": true,
      "passed": true
    },
    "decision_fixture": {
      "expected": true,
      "metric": "decision_fixture.valid",
      "observed": true,
      "passed": true
    },
    "decision_hash": {
      "expected": true,
      "metric": "decision_fixture.hash_valid",
      "observed": true,
      "passed": true
    },
    "evidence_fixture": {
      "expected": true,
      "metric": "evidence_fixture.valid",
      "observed": true,
      "passed": true
    },
    "policy_version": {
      "expected": "1.0.0",
      "metric": "decision_policy.version",
      "observed": "1.0.0",
      "passed": true
    },
    "step11c_report": {
      "expected": true,
      "metric": "summary.overall_passed",
      "observed": true,
      "passed": true
    },
    "step11d_report": {
      "expected": true,
      "metric": "summary.overall_passed",
      "observed": true,
      "passed": true
    },
    "step11e_report": {
      "expected": true,
      "metric": "summary.overall_passed",
      "observed": true,
      "passed": true
    },
    "step11f_report": {
      "expected": true,
      "metric": "summary.overall_passed",
      "observed": true,
      "passed": true
    }
  },
  "catalog": {
    "catalog_id": "AEGIS-TEMPORAL-REPLAY-SCENARIO-CATALOG",
    "harness_version": "0.1.0",
    "relative_path": "policies/assurance/temporal_replay_scenario_catalog_v1.yaml",
    "sha256": "cc0227316b2d74480ae911a5bb3b49b37b14c8966c3b07082d133bee65d8b853",
    "version": "1.0.0"
  },
  "deterministic_clock": {
    "evaluation_time": "2026-07-13T17:03:00+00:00",
    "wall_clock_reads_used_for_scenarios": false
  },
  "generated_at": "2026-07-15T10:51:53.060418+00:00",
  "harness_error_scenario_ids": [],
  "input_integrity_checks_after": {
    "asset_fixture": {
      "actual_sha256": "bc9cb98980010ca2bc1c123e808296a2e17bb34a5735cf42cd07e1efcfc64395",
      "exists": true,
      "expected_sha256": "bc9cb98980010ca2bc1c123e808296a2e17bb34a5735cf42cd07e1efcfc64395",
      "passed": true,
      "relative_path": "data/sample_inputs/assets/valid_healthcare_asset.json",
      "safe_path": true
    },
    "assurance_corpus": {
      "actual_sha256": "d51747056c4f920d5e0b6bfb51613b4e1ee1910de82770aa179dd3fe77f68ded",
      "exists": true,
      "expected_sha256": "d51747056c4f920d5e0b6bfb51613b4e1ee1910de82770aa179dd3fe77f68ded",
      "passed": true,
      "relative_path": "data/assurance/step11a_policy_rule_coverage_corpus.jsonl",
      "safe_path": true
    },
    "assurance_manifest": {
      "actual_sha256": "d1fdd9308b973e5248e464daf528a376bca6bc6c27b9d45f267b88f842797465",
      "exists": true,
      "expected_sha256": "d1fdd9308b973e5248e464daf528a376bca6bc6c27b9d45f267b88f842797465",
      "passed": true,
      "relative_path": "data/assurance/step11a_policy_rule_coverage_manifest.json",
      "safe_path": true
    },
    "decision_fixture": {
      "actual_sha256": "7d557b127eb2cb6ae097be75273cad3e3d0cd0876385dd74d2439c762254f37a",
      "exists": true,
      "expected_sha256": "7d557b127eb2cb6ae097be75273cad3e3d0cd0876385dd74d2439c762254f37a",
      "passed": true,
      "relative_path": "data/sample_inputs/decisions/valid_log4shell_decision_record_policy.json",
      "safe_path": true
    },
    "decision_hashing_module": {
      "actual_sha256": "3b0a1eff5d2b97064d6dfb43936dde0bf2b1c23574a447afae13e2b02886853f",
      "exists": true,
      "expected_sha256": "3b0a1eff5d2b97064d6dfb43936dde0bf2b1c23574a447afae13e2b02886853f",
      "passed": true,
      "relative_path": "src/domain/decision_hashing.py",
      "safe_path": true
    },
    "decision_policy": {
      "actual_sha256": "fd5f39cec54f4bb57491d60bff9326f9b854209d3ab907cdab8768029a35447f",
      "exists": true,
      "expected_sha256": "fd5f39cec54f4bb57491d60bff9326f9b854209d3ab907cdab8768029a35447f",
      "passed": true,
      "relative_path": "policies/decision/federal_base_policy_v1.yaml",
      "safe_path": true
    },
    "decision_schema": {
      "actual_sha256": "e54a394ef9c772d3dce070f359051d6accf5761b1983ca9721e03e80a9e54ba3",
      "exists": true,
      "expected_sha256": "e54a394ef9c772d3dce070f359051d6accf5761b1983ca9721e03e80a9e54ba3",
      "passed": true,
      "relative_path": "schemas/aegis_decision_record.schema.json",
      "safe_path": true
    },
    "decision_validator": {
      "actual_sha256": "f1ef851a8f875680fc5e919b9276effc8d7c2feb00005b893f163ed47136806f",
      "exists": true,
      "expected_sha256": "f1ef851a8f875680fc5e919b9276effc8d7c2feb00005b893f163ed47136806f",
      "passed": true,
      "relative_path": "src/validation/decision_record_validator.py",
      "safe_path": true
    },
    "evidence_fixture": {
      "actual_sha256": "21ed78284567bc33bb463fb2525941829b80c7e21144d17677f022d168a3c2de",
      "exists": true,
      "expected_sha256": "21ed78284567bc33bb463fb2525941829b80c7e21144d17677f022d168a3c2de",
      "passed": true,
      "relative_path": "data/sample_inputs/evidence/valid_log4j_sbom_evidence.json",
      "safe_path": true
    },
    "evidence_schema": {
      "actual_sha256": "adaef9c4a1a837fddebee3d40cc03d6d99592682b3c42f1c24dded2fc74ce772",
      "exists": true,
      "expected_sha256": "adaef9c4a1a837fddebee3d40cc03d6d99592682b3c42f1c24dded2fc74ce772",
      "passed": true,
      "relative_path": "schemas/aegis_evidence_record.schema.json",
      "safe_path": true
    },
    "evidence_trust_engine": {
      "actual_sha256": "78943367308a8fcc07e085da0e45fe75013f216d23f0fac3f1e749f148c74fc7",
      "exists": true,
      "expected_sha256": "78943367308a8fcc07e085da0e45fe75013f216d23f0fac3f1e749f148c74fc7",
      "passed": true,
      "relative_path": "src/governance/evidence_trust_engine.py",
      "safe_path": true
    },
    "intelligence_fixture": {
      "actual_sha256": "e2204ab8ff8736c0826ffe24d518cef462a75dcea7e498943506b0fe7f41ff1f",
      "exists": true,
      "expected_sha256": "e2204ab8ff8736c0826ffe24d518cef462a75dcea7e498943506b0fe7f41ff1f",
      "passed": true,
      "relative_path": "data/sample_inputs/intelligence/valid_log4shell_intelligence.json",
      "safe_path": true
    },
    "step11c_report": {
      "actual_sha256": "74f0849ee40aa73f09b9abf23929bbaf4a355d51f00c9b01958b01f943867a23",
      "exists": true,
      "expected_sha256": "74f0849ee40aa73f09b9abf23929bbaf4a355d51f00c9b01958b01f943867a23",
      "passed": true,
      "relative_path": "data/validation_reports/tampering/step11c_tamper_assurance_report.json",
      "safe_path": true
    },
    "step11d_report": {
      "actual_sha256": "8c21529e07fa9b9b196a002d64fa302e7f9ec10da3e1fec9b7070bdd6d6b6f69",
      "exists": true,
      "expected_sha256": "8c21529e07fa9b9b196a002d64fa302e7f9ec10da3e1fec9b7070bdd6d6b6f69",
      "passed": true,
      "relative_path": "data/validation_reports/hostile_inputs/step11d_hostile_input_report.json",
      "safe_path": true
    },
    "step11e_report": {
      "actual_sha256": "18c1b8986c318a815d5d954df2686846b5d97ac30727fb94c24ac72e635e652e",
      "exists": true,
      "expected_sha256": "18c1b8986c318a815d5d954df2686846b5d97ac30727fb94c24ac72e635e652e",
      "passed": true,
      "relative_path": "data/validation_reports/metamorphic/step11e_metamorphic_assurance_report.json",
      "safe_path": true
    },
    "step11f_report": {
      "actual_sha256": "2b67f31c55bbe51ed52c83b8bba01fc8ad41b424b24f55d750d7bf2e6f03379f",
      "exists": true,
      "expected_sha256": "2b67f31c55bbe51ed52c83b8bba01fc8ad41b424b24f55d750d7bf2e6f03379f",
      "passed": true,
      "relative_path": "data/validation_reports/compound_attacks/step11f_compound_attack_report.json",
      "safe_path": true
    },
    "trust_policy": {
      "actual_sha256": "6a4b41df0d5084bdc8a82c6c82714376253af9229ab1474dc73727d966359249",
      "exists": true,
      "expected_sha256": "6a4b41df0d5084bdc8a82c6c82714376253af9229ab1474dc73727d966359249",
      "passed": true,
      "relative_path": "policies/trust/evidence_trust_policy_v1.yaml",
      "safe_path": true
    }
  },
  "input_integrity_checks_before": {
    "asset_fixture": {
      "actual_sha256": "bc9cb98980010ca2bc1c123e808296a2e17bb34a5735cf42cd07e1efcfc64395",
      "exists": true,
      "expected_sha256": "bc9cb98980010ca2bc1c123e808296a2e17bb34a5735cf42cd07e1efcfc64395",
      "passed": true,
      "relative_path": "data/sample_inputs/assets/valid_healthcare_asset.json",
      "safe_path": true
    },
    "assurance_corpus": {
      "actual_sha256": "d51747056c4f920d5e0b6bfb51613b4e1ee1910de82770aa179dd3fe77f68ded",
      "exists": true,
      "expected_sha256": "d51747056c4f920d5e0b6bfb51613b4e1ee1910de82770aa179dd3fe77f68ded",
      "passed": true,
      "relative_path": "data/assurance/step11a_policy_rule_coverage_corpus.jsonl",
      "safe_path": true
    },
    "assurance_manifest": {
      "actual_sha256": "d1fdd9308b973e5248e464daf528a376bca6bc6c27b9d45f267b88f842797465",
      "exists": true,
      "expected_sha256": "d1fdd9308b973e5248e464daf528a376bca6bc6c27b9d45f267b88f842797465",
      "passed": true,
      "relative_path": "data/assurance/step11a_policy_rule_coverage_manifest.json",
      "safe_path": true
    },
    "decision_fixture": {
      "actual_sha256": "7d557b127eb2cb6ae097be75273cad3e3d0cd0876385dd74d2439c762254f37a",
      "exists": true,
      "expected_sha256": "7d557b127eb2cb6ae097be75273cad3e3d0cd0876385dd74d2439c762254f37a",
      "passed": true,
      "relative_path": "data/sample_inputs/decisions/valid_log4shell_decision_record_policy.json",
      "safe_path": true
    },
    "decision_hashing_module": {
      "actual_sha256": "3b0a1eff5d2b97064d6dfb43936dde0bf2b1c23574a447afae13e2b02886853f",
      "exists": true,
      "expected_sha256": "3b0a1eff5d2b97064d6dfb43936dde0bf2b1c23574a447afae13e2b02886853f",
      "passed": true,
      "relative_path": "src/domain/decision_hashing.py",